[
  {
    "sourceUrl": "http://adeemcapital.com/",
    "orgId": "adeem",
    "lastAttemptISO": "2026-09-29T17:09:59.497Z",
    "lastSuccessISO": "2026-09-29T17:09:59.497Z",
    "consecutiveFailures": 0,
    "lastError": null,
    "state": "healthy"
  },
  {
    "sourceUrl": "http://www.ecza.gov.sa/360/pages/ar/home",
    "orgId": "ecza",
    "lastAttemptISO": "2026-09-29T17:09:59.497Z",
    "lastSuccessISO": "2026-09-21T12:03:28.343Z",
    "consecutiveFailures": 28,
    "lastError": "HTTP 404",
    "state": "broken"
  },
  {
    "sourceUrl": "http://www.moenergy.gov.sa/",
    "orgId": "moenergy",
    "lastAttemptISO": "2026-09-29T17:09:59.497Z",
    "lastSuccessISO": "2026-09-01T21:35:09.513Z",
    "consecutiveFailures": 106,
    "lastError": "robots.txt: could not reach robots.txt after 3 attempt(s) (fetch failed); this is our connection, not the site, and we do not crawl without reading it; a browser could not reach it either",
    "state": "broken"
  },
  {
    "sourceUrl": "http://www.wasatah.com.sa/index.php/ar/",
    "orgId": "wasatah",
    "lastAttemptISO": "2026-09-29T17:09:59.497Z",
    "lastSuccessISO": "2026-09-29T17:09:59.497Z",
    "consecutiveFailures": 0,
    "lastError": null,
    "state": "healthy"
  },
  {
    "sourceUrl": "https://adf.gov.sa/ar/media-center/events/Pages/default.aspx",
    "orgId": "adf",
    "lastAttemptISO": "2026-09-29T17:09:59.497Z",
    "lastSuccessISO": "2026-09-01T21:35:09.513Z",
    "consecutiveFailures": 106,
    "lastError": "robots.txt: could not reach robots.txt after 3 attempt(s) (fetch failed); this is our connection, not the site, and we do not crawl without reading it; a browser could not reach it either",
    "state": "broken"
  },
  {
    "sourceUrl": "https://adf.gov.sa/ar/media-center/news/Pages/default.aspx",
    "orgId": "adf",
    "lastAttemptISO": "2026-09-29T17:09:59.497Z",
    "lastSuccessISO": "2026-09-01T21:35:09.513Z",
    "consecutiveFailures": 106,
    "lastError": "robots.txt: could not reach robots.txt after 3 attempt(s) (fetch failed); this is our connection, not the site, and we do not crawl without reading it; a browser could not reach it either",
    "state": "broken"
  },
  {
    "sourceUrl": "https://adf.gov.sa/ar/media-center/success-stories/Pages/default.aspx",
    "orgId": "adf",
    "lastAttemptISO": "2026-09-29T17:09:59.497Z",
    "lastSuccessISO": "2026-09-01T21:35:09.513Z",
    "consecutiveFailures": 106,
    "lastError": "robots.txt: could not reach robots.txt after 3 attempt(s) (fetch failed); this is our connection, not the site, and we do not crawl without reading it; a browser could not reach it either",
    "state": "broken"
  },
  {
    "sourceUrl": "https://adf.gov.sa/ar/Pages/default.aspx",
    "orgId": "adf",
    "lastAttemptISO": "2026-09-29T17:09:59.497Z",
    "lastSuccessISO": "2026-09-01T21:35:09.513Z",
    "consecutiveFailures": 106,
    "lastError": "robots.txt: could not reach robots.txt after 3 attempt(s) (fetch failed); this is our connection, not the site, and we do not crawl without reading it; a browser could not reach it either",
    "state": "broken"
  },
  {
    "sourceUrl": "https://adf.gov.sa/ar/Pages/employment.aspx",
    "orgId": "adf",
    "lastAttemptISO": "2026-09-29T17:09:59.497Z",
    "lastSuccessISO": "2026-09-01T21:35:09.513Z",
    "consecutiveFailures": 106,
    "lastError": "robots.txt: could not reach robots.txt after 3 attempt(s) (fetch failed); this is our connection, not the site, and we do not crawl without reading it; a browser could not reach it either",
    "state": "broken"
  },
  {
    "sourceUrl": "https://adf.gov.sa/ar/Pages/training-request.aspx",
    "orgId": "adf",
    "lastAttemptISO": "2026-09-29T17:09:59.497Z",
    "lastSuccessISO": "2026-09-01T21:35:09.513Z",
    "consecutiveFailures": 106,
    "lastError": "robots.txt: could not reach robots.txt after 3 attempt(s) (fetch failed); this is our connection, not the site, and we do not crawl without reading it; a browser could not reach it either",
    "state": "broken"
  },
  {
    "sourceUrl": "https://adf.gov.sa/ar/Pages/training.aspx",
    "orgId": "adf",
    "lastAttemptISO": "2026-09-29T17:09:59.497Z",
    "lastSuccessISO": "2026-09-01T21:35:09.513Z",
    "consecutiveFailures": 106,
    "lastError": "robots.txt: could not reach robots.txt after 3 attempt(s) (fetch failed); this is our connection, not the site, and we do not crawl without reading it; a browser could not reach it either",
    "state": "broken"
  },
  {
    "sourceUrl": "https://alinma.com/",
    "orgId": "alinma",
    "lastAttemptISO": "2026-09-29T17:09:59.497Z",
    "lastSuccessISO": "2026-09-29T17:09:59.497Z",
    "consecutiveFailures": 0,
    "lastError": null,
    "state": "healthy"
  },
  {
    "sourceUrl": "https://alinma.com/About-the-Bank/The-Bank/News",
    "orgId": "alinma",
    "lastAttemptISO": "2026-09-29T17:09:59.497Z",
    "lastSuccessISO": "2026-09-29T17:09:59.497Z",
    "consecutiveFailures": 0,
    "lastError": null,
    "state": "healthy"
  },
  {
    "sourceUrl": "https://alinma.com/About-the-Bank/The-Bank/News/2009/02/alinma-bank-selects-and-prepares-its-phone-banking-and-training-center-location",
    "orgId": "alinma",
    "lastAttemptISO": "2026-09-29T17:09:59.497Z",
    "lastSuccessISO": "2026-09-29T17:09:59.497Z",
    "consecutiveFailures": 0,
    "lastError": null,
    "state": "healthy"
  },
  {
    "sourceUrl": "https://alinma.com/About-the-Bank/The-Bank/News/2010/01/alinma-bank-signs-agreement-with-specialized-academy-for-medical-training-for-financing-tuition-fees",
    "orgId": "alinma",
    "lastAttemptISO": "2026-09-29T17:09:59.497Z",
    "lastSuccessISO": "2026-09-29T17:09:59.497Z",
    "consecutiveFailures": 0,
    "lastError": null,
    "state": "healthy"
  },
  {
    "sourceUrl": "https://alinma.com/About-the-Bank/The-Bank/News/2011/02/alinma-bank-and-al-khaleej-training-and-education-company-sign-education-financing-agreement",
    "orgId": "alinma",
    "lastAttemptISO": "2026-09-29T17:09:59.497Z",
    "lastSuccessISO": "2026-09-29T17:09:59.497Z",
    "consecutiveFailures": 0,
    "lastError": null,
    "state": "healthy"
  },
  {
    "sourceUrl": "https://alinma.com/About-the-Bank/The-Bank/News/2011/05/alinma-bank-participates-at-university-career-fairs",
    "orgId": "alinma",
    "lastAttemptISO": "2026-09-29T17:09:59.497Z",
    "lastSuccessISO": "2026-09-29T17:09:59.497Z",
    "consecutiveFailures": 0,
    "lastError": null,
    "state": "healthy"
  },
  {
    "sourceUrl": "https://alinma.com/About-the-Bank/The-Bank/News/2011/05/alinma-bank-to-participate-in-the-career-day-at-taiba-university",
    "orgId": "alinma",
    "lastAttemptISO": "2026-09-29T17:09:59.497Z",
    "lastSuccessISO": "2026-09-29T17:09:59.497Z",
    "consecutiveFailures": 0,
    "lastError": null,
    "state": "healthy"
  },
  {
    "sourceUrl": "https://alinma.com/About-the-Bank/The-Bank/News/2011/10/alinma-bank-hosts-training-course-on-corporate-business-services-and-e-banking-2011",
    "orgId": "alinma",
    "lastAttemptISO": "2026-09-29T17:09:59.497Z",
    "lastSuccessISO": "2026-09-29T17:09:59.497Z",
    "consecutiveFailures": 0,
    "lastError": null,
    "state": "healthy"
  },
  {
    "sourceUrl": "https://alinma.com/About-the-Bank/The-Bank/News/2011/12/alinma-bank-hosts-training-course-on-corporate-business-services-and-e-banking",
    "orgId": "alinma",
    "lastAttemptISO": "2026-09-29T17:09:59.497Z",
    "lastSuccessISO": "2026-09-29T17:09:59.497Z",
    "consecutiveFailures": 0,
    "lastError": null,
    "state": "healthy"
  },
  {
    "sourceUrl": "https://alinma.com/About-the-Bank/The-Bank/News/2011/12/alinmabankhoststrainingcourseoncorporatebusinessservicesandebanking",
    "orgId": "alinma",
    "lastAttemptISO": "2026-09-29T17:09:59.497Z",
    "lastSuccessISO": "2026-09-29T17:09:59.497Z",
    "consecutiveFailures": 0,
    "lastError": null,
    "state": "healthy"
  },
  {
    "sourceUrl": "https://alinma.com/About-the-Bank/The-Bank/News/2013/05/alinmajobandcareerdayattractsgraduatesoftheinstituteofpublicadministration",
    "orgId": "alinma",
    "lastAttemptISO": "2026-09-29T17:09:59.497Z",
    "lastSuccessISO": "2026-09-29T17:09:59.497Z",
    "consecutiveFailures": 0,
    "lastError": null,
    "state": "healthy"
  },
  {
    "sourceUrl": "https://alinma.com/About-the-Bank/The-Bank/News/2014/04/alinma-bank-participates-in-career-day-at-al-imam-university",
    "orgId": "alinma",
    "lastAttemptISO": "2026-09-29T17:09:59.497Z",
    "lastSuccessISO": "2026-09-29T17:09:59.497Z",
    "consecutiveFailures": 0,
    "lastError": null,
    "state": "healthy"
  },
  {
    "sourceUrl": "https://alinma.com/About-the-Bank/The-Bank/News/2026/8/amwal-tech",
    "orgId": "alinma",
    "lastAttemptISO": "2026-09-29T17:09:59.497Z",
    "lastSuccessISO": "2026-09-29T17:09:59.497Z",
    "consecutiveFailures": 0,
    "lastError": null,
    "state": "healthy"
  },
  {
    "sourceUrl": "https://alinma.com/About-the-Bank/The-Bank/News/2026/8/IFN-Awards",
    "orgId": "alinma",
    "lastAttemptISO": "2026-09-29T17:09:59.497Z",
    "lastSuccessISO": "2026-09-29T17:09:59.497Z",
    "consecutiveFailures": 0,
    "lastError": null,
    "state": "healthy"
  },
  {
    "sourceUrl": "https://alinma.com/en/About-the-Bank/The-Bank/News/2009/02/alinma-bank-selects-and-prepares-its-phone-banking-and-training-center-location",
    "orgId": "alinma",
    "lastAttemptISO": "2026-09-29T17:09:59.497Z",
    "lastSuccessISO": "2026-09-29T17:09:59.497Z",
    "consecutiveFailures": 0,
    "lastError": null,
    "state": "healthy"
  },
  {
    "sourceUrl": "https://alinma.com/en/About-the-Bank/The-Bank/News/2010/01/alinma-bank-signs-agreement-with-specialized-academy-for-medical-training-for-financing-tuition-fees",
    "orgId": "alinma",
    "lastAttemptISO": "2026-09-29T17:09:59.497Z",
    "lastSuccessISO": "2026-09-29T17:09:59.497Z",
    "consecutiveFailures": 0,
    "lastError": null,
    "state": "healthy"
  },
  {